{"schema":"fcmo-essay-doc-v1","locale":"en","title":"A durable public record","dek":"A fixture essay about careful decisions.","blocks":[{"id":"b-12345678","type":"h2","content":[{"t":"text","v":"A clear beginning"}]},{"id":"b-23456789","type":"p","content":[{"t":"text","v":"A durable public record helps people make careful decisions."},{"t":"fn","id":"fn-12345678"},{"t":"text","v":" and examine the source."},{"t":"cite","key":"source-one","locator":"p. 2"}]},{"id":"b-3456789a","type":"figure","attrs":{"fig":"fig-cover"}},{"id":"b-456789ab","type":"evidence","attrs":{"class":"B","confidence":"Moderate","limits":[{"t":"text","v":"This fixture does not establish general outcomes."}]}}],"footnotes":{"fn-12345678":[{"t":"text","v":"A footnote with enough detail."}]}}
